Haber İsmi,Kategori
"Bahçeşehir Koleji, Manisa Basket'e takılmadı!",Basketbol_Sporları
Fenerbahçe Opet deplasmanda 25 sayı fark attı!,Basketbol_Sporları
"Karşıyaka, Darüşşafaka Lassa'yı 101 sayıyla geçti!",Basketbol_Sporları
"Dilara Tongar, Melikgazi Kayseri Basketbol'da!",Basketbol_Sporları
"Real Madrid'in yıldızı Vinicius Jr, EuroLeague'de Fenerbahçe maçını izledi!",Basketbol_Sporları
"Anadolu Efes, EuroLeague'de Zalgiris'e kaybetti!",Basketbol_Sporları
LeBron James'e eski takımından 41 sayı fark,Basketbol_Sporları
"TOFAŞ, Avrupa Kupası'na galibiyetle başladı!",Basketbol_Sporları
Alperen Şengün'ün çabası Rockets'a yetmedi! NBA Kupası'nda finalin adı belli oldu,Basketbol_Sporları
TOFAŞ'ın serisini Fenerbahçe Beko bitirdi!,Basketbol_Sporları
Fenerbahçe Beko - TOFAŞ maçından kareler,Basketbol_Sporları
"Aliağa Petkimspor, Karşıyaka'yı mağlup etti!",Basketbol_Sporları
"Mersin Spor, Türk Telekom'u farklı geçti!",Basketbol_Sporları
Ergin Ataman: Bugün berbat bir basketbol oynadık!,Basketbol_Sporları
Tomislav Mijatovic: Hedeflediğimiz noktalara ulaşmalıyız!,Basketbol_Sporları
"Anadolu Efes, Panathinaikos'u farklı geçti!",Basketbol_Sporları
"Galatasaray, Bursaspor Yörsan deplasmanında galip!",Basketbol_Sporları
Anadolu Efes - Panathinaikos maçından kareler,Basketbol_Sporları
TBF Disiplin Kurulu'ndan Fenerbahçe Opet'e para cezası!,Basketbol_Sporları
NBA'de Miami Heat 4'te 4 yaptı,Basketbol_Sporları
NBA ve FIFA'dan çılgın proje! Fenerbahçe Beko'ya teklif,Basketbol_Sporları
Sarunas Jasikevicius: Asla bahane kabul edilemez!,Basketbol_Sporları
"Fenerbahçe Beko, Monaco'ya farklı mağlup oldu!",Basketbol_Sporları
Fenerbahçe Beko - Monaco maçından kareler,Basketbol_Sporları
"Fenerbahçe Opet, USK Prag'ı mağlup etti!",Basketbol_Sporları
Anadolu Efes'in konuğu Ergin Ataman'ın takımı Panathinaikos,Basketbol_Sporları
Basketbol Süper Ligi'nde haftanın MVP’si Errick McCollum,Basketbol_Sporları
Beşiktaş Fibabanka'dan Bahçeşehir Koleji galibiyeti!,Basketbol_Sporları
Galatasaray Çağdaş Faktoring'ten Kızılyıldız zaferi!,Basketbol_Sporları
"Galatasaray, Yalovaspor engeline takılmadı!",Basketbol_Sporları
TOFAŞ hem Türkiye hem de Avrupa'da namağlup!,Basketbol_Sporları
"NBA'de Alperen Şengün double-double yaptı, Houston Rockets kazandı!",Basketbol_Sporları
