Haber İsmi,Kategori
"Le Monde, TIMSS sonuçları için Fransız eğitim sistemini eleştirdi",Eğitim
Üniversiteyi 34 yıl sonra kazandı! 3 ay içerisinde şehir değiştirip iş buldu,Eğitim
29 yaşındaki Melek öğretmenin azmi hayran bıraktı,Eğitim
Öğrencilere sanal eğitim asistanı,Eğitim
Bakan Tekin'den okul öncesi eğitim mesajı,Eğitim
Bilim meraklısı çocuklar İzmir’de buluştu,Eğitim
Hataylı gençlere eğitim ve spor desteği,Eğitim
Türkiye’deki üniversiteler yurtdışında program açabilecek,Eğitim
Okul servislerine yeni kurallar,Eğitim
Şiddet katman katman ilerliyor,Eğitim
Çevreyi kirletene af yok! 1 milyar 110 milyon lira ceza kesildi,Eğitim
Akran zorbalığına İskandinav modeli,Eğitim
20 yıl sonra Melek öğretmene büyük sürpriz! 'Onur verici',Eğitim
"Eksi netle üniversiteli oldular! Diyaliz, fizyoterapi, Türk Dili ve Edebiyatı kazananlar bile var",Eğitim
"Tek yumurta üçüzleri Nehir, Yağmur ve Deniz! İşte en büyük hayalleri...",Eğitim
Fabrika gibi okul! Öğretmen ve öğrencilere 6 milyon TL dağıtılıyor,Eğitim
"Bu ailede herkes öğretmen! Amca, baba, 5 çocuğu ve 5 gelini...",Eğitim
300 erkek öğrenci arasında tek kız öğrenci: Şakaları bile farklı oluyor,Eğitim
7 yaşında Türkiye'nin Da Vinci'si: İnanılmaz bir yeteneğe sahip,Eğitim
Üniversiteler arasında iş birliği protokolü imzalandı,Eğitim
Kayseri Cumhuriyet Başsavcılığı ile iki üniversite arasında protokol imzalandı,Eğitim
Öğrenciler dikkat! İki aylık burs ve kredi ödemeleri başladı,Eğitim
9 günlük ara tatilin ardından okullarda ders zili yarın çalacak,Eğitim
75 yaşındaki emekli mühendisin eğitim aşkı! Kocaeli-İstanbul arasında 6 saatlik yolculuk,Eğitim
Erzurum’da Maarif Kongresi düzenlenecek,Eğitim
Köylerde meraklı sınıflar kurulacak,Eğitim
İki üniversite istihdam lideri,Eğitim
Akademi Giriş Sınavı 13 Temmuz’da,Eğitim
Bakan Tekin: Mülakatla 1100 öğretmenin sıralaması değişt,Eğitim
YÖK Başkanı Özvar: Hedefimiz Türkiye'yi küresel etkiye sahip bir araştırma merkezi haline getirmektir,Eğitim
"Korkarak geldi, ağlayarak döndü: Ailem beni hangi cesaretle böyle bir köye bırakıp gitti",Eğitim
Türkiye’den Kongo’ya mesleki eğitim desteği,Eğitim
2024-YKS spor bilimleri için ÖZYES ek yerleştirme sonuçları açıklandı,Eğitim
Bakan Tekin: Sanatçı yetiştirme sürecinde sorumluluğumuzun farkındayız,Eğitim
Rehabilitasyon merkezlerine biyometrik kimlik doğrulama geliyor,Eğitim
Akdeniz Üniversitesi URAP sıralamasında yükseldi,Eğitim
Bezmialem’de leptin hormonu sempozyumu,Eğitim
"Ara tatil başladı, okul turlarında firmaya dikkat!",Eğitim
Göbeklitepelilerin atası: Çakmaktepeliler,Eğitim
Ara tatil için dengeli program,Eğitim
2024-KPSS’de sonuçlar yeniden değerlendirildi,Eğitim
"YÖK Başkanı Prof. Dr. Özvar, Kayseri’ye geliyor",Eğitim
LGS 15 Haziran’da yapılacak,Eğitim
Okullarda yaşam becerileri öğretilecek,Eğitim
15 yılda 1500 gence ulaştı,Eğitim
Kızılay Sokağı’na 20 bin çocuk ziyaretçi,Eğitim
Doğayla iç içe ders,Eğitim
Türkiye’ye ‘Nitelikli’ araştırmacı ilgisi! Yurt dışından 192 araştırmacı,Eğitim
"Milli Eğitim Bakanı Tekin, ÖSYM Başkanı Ersoy'u kabul etti",Eğitim
Türkiye’nin ilk sektör içi mesleki eğitim merkezi açılıyor,Eğitim
