Haber İsmi,Kategori
Serdal Adalı: İtibar kaybı çok büyük | Hüseyin Yücel: Akatlar projesi borcu öder,Futbol_Sporları
Arda Güler'in performansı dünyanın gündeminde!,Futbol_Sporları
Nihat Kahveci'den Nesyri iddiası ve kırmızı kart yorumu: Adama niye kafa attın?,Futbol_Sporları
Galatasaray'da Okan Buruk'tan Osimhen kararı!,Futbol_Sporları
"Paris Saint Germain, Olimpik Lyon'u 3 golle devirdi!",Futbol_Sporları
Joao Mario: Kendimi tamamen Beşiktaş'a adadım!,Futbol_Sporları
"Tottenham, Southampton'ı deplasmanda 5 golle geçti!",Futbol_Sporları
"Chelsea, Brentford karşısında 2 golle galip!",Futbol_Sporları
Galatasaray'dan Trabzonspor'un golüne tepki!,Futbol_Sporları
Trabzonspor'da Uğurcan Çakır ve Batista Mendy tartıştı!,Futbol_Sporları
"Galatasaray, Trabzonspor'u 90+8'de devirdi! İnanılmaz maçta 7 gol ve 1 penaltı",Futbol_Sporları
TFF'den Adana Demirsporlu Maestro'ya başsağlığı mesajı!,Futbol_Sporları
Galatasaray'da Roland Sallai cezalı duruma düştü!,Futbol_Sporları
Galatasaray - Trabzonspor maçında tartışmalı kararlar! Gol öncesi top çizgiyi geçti mi?,Futbol_Sporları
Trabzonspor'dan Galatasaray maçında sarı kart tepkisi!,Futbol_Sporları
Beşiktaş'ta Hasan Arat paylaşımı silindi!,Futbol_Sporları
Mustafa Dalcı: Benim için gerçekten normaldi!,Futbol_Sporları
Hüseyin Yücel: Sorumlularının hesap vermesi gerekiyor!,Futbol_Sporları
Serdar Topraktepe: Camiamdan ve taraftarımdan özür diliyorum!,Futbol_Sporları
Deniz Eren Dönmezer: Küçüklüğümden beri böyle maçların hayalini kurdum!,Futbol_Sporları
Mert Günok: Burada olmaya yüzüm yok!,Futbol_Sporları
Salih Uçan: İçeriden bazı şeylere şahit oluyoruz!,Futbol_Sporları
Galatasaray - Trabzonspor maçından kareler,Futbol_Sporları
"Beşiktaş, Adana Demirspor'a mağlup! 3 gollü maçta kırmızı kart çıktı",Futbol_Sporları
Sivasspor'da Ömer Erdoğan dönemi başladı!,Futbol_Sporları
Beşiktaşlı futbolcular taraftarlardan özür diledi! Maç bitmeden sürpriz çağrı,Futbol_Sporları
Maestro'ya Beşiktaş maçının devre arasında acı haber! Kardeşi vefat etti,Futbol_Sporları
Adana Demirspor - Beşiktaş maçından kareler,Futbol_Sporları
Veysel Bilen: Umarım her şey istediğimiz gibi olur!,Futbol_Sporları
1. Lig'de Sakaryaspor düşme hattından kurtulamıyor!,Futbol_Sporları
Gaziantep FK'da 52 Orduspor FK maçı mesaisi başladı!,Futbol_Sporları
"Alanyaspor, Amedspor maçına hazır!",Futbol_Sporları
